{
  "$schema": "http://json-schema.org/draft-07/schema#",
  "$id": "https://github.com/devganeshg/ai-archi/schemas/architecture.schema.json",
  "title": "ai-archi architecture IR",
  "description": "Input for renderers/render-architecture.mjs. Grid cells, not pixels: col picks the tier (x = 60 + col*240), row the lane (y = 120 + row*100). The renderer computes all geometry, routes edges orthogonally, fans parallel edges, inlines icons from the asset libraries, and wires up flow animation + the step player.",
  "type": "object",
  "required": ["diagram", "title", "nodes"],
  "additionalProperties": false,
  "properties": {
    "diagram": { "const": "architecture" },
    "title": { "type": "string", "minLength": 1 },
    "subtitle": { "type": "string", "description": "One-line story under the title" },
    "zones": {
      "type": "array",
      "items": {
        "type": "object",
        "required": ["id", "nodes"],
        "additionalProperties": false,
        "properties": {
          "id": { "type": "string" },
          "label": { "type": "string", "description": "Rendered uppercase; defaults to id" },
          "nodes": { "type": "array", "items": { "type": "string" }, "minItems": 1 },
          "accent": { "enum": ["client", "gateway", "compute", "storage", "queue", "external", "security", "observe"], "description": "Colors the boundary, e.g. security for a PII boundary" }
        }
      }
    },
    "nodes": {
      "type": "array",
      "minItems": 1,
      "items": {
        "type": "object",
        "required": ["id", "label", "type", "col", "row"],
        "additionalProperties": false,
        "properties": {
          "id": { "type": "string" },
          "label": { "type": "string", "description": "Role name, e.g. 'App Service'" },
          "sublabel": { "type": "string", "description": "Semantic tech labels, e.g. 'node.js · k8s'" },
          "type": { "enum": ["client", "gateway", "compute", "storage", "queue", "external", "security", "observe"] },
          "col": { "type": "number", "minimum": 0, "description": "Tier, left to right" },
          "row": { "type": "number", "minimum": 0, "description": "Lane, top to bottom; fractions allowed" },
          "icon": { "type": "string", "description": "Asset-library icon id (see assets/INDEX.md); defaults to the category glyph" },
          "width": { "type": "number", "description": "Override the 168px default when a label needs room (max 200 per column)" }
        }
      }
    },
    "edges": {
      "type": "array",
      "items": {
        "type": "object",
        "required": ["from", "to"],
        "additionalProperties": false,
        "properties": {
          "from": { "type": "string" },
          "to": { "type": "string" },
          "label": { "type": "string", "description": "Only for cross-boundary or non-obvious hops" },
          "step": { "type": "integer", "minimum": 1, "description": "Position in the step-player narration; steps must be contiguous from 1" },
          "flow": { "type": "boolean", "description": "Marching-dash overlay; defaults to true on stepped edges" },
          "packet": { "type": "boolean", "description": "Dot traveling the path; use on 2-4 primary edges max" },
          "dotted": { "type": "boolean", "description": "Advisory links: metrics, traces, fallback" },
          "accent": { "enum": ["client", "gateway", "compute", "storage", "queue", "external", "security", "observe"], "description": "Color override; defaults to the target node's category" },
          "labelDy": { "type": "number", "description": "Vertical label nudge when the validator reports a collision" }
        }
      }
    }
  }
}
